{
  "$schema": "https://raw.githubusercontent.com/mmdemirbas/html-doc/main/kit/schema/page.schema.json",
  "kind": "page",
  "schema_version": 1,
  "title": "Spark integration",
  "accent": "teal",
  "meta": {
    "eyebrow": "Engine · v2 demo",
    "subtitle": "Second page in the demo knowledge base — used to verify <page-nav> renders the tree and active-page highlighting works.",
    "audience": "Spark+Iceberg team",
    "date": "2026-05-17",
    "read_time": "~3 min read",
    "order": 20,
    "summary": "Iceberg's most mature engine integration."
  },
  "blocks": [
    {
      "kind": "tldr",
      "summary": "Spark is the deepest Iceberg integration: full read/write/maintenance with the IcebergSource API and procedures for rewrite/expire/snapshot management.",
      "bullets": [
        "Use Iceberg's Spark catalog for transactional table operations.",
        "MERGE INTO, schema evolution, and partition evolution all supported.",
        "Procedures: rewrite_data_files, expire_snapshots, remove_orphan_files.",
        "Structured streaming reads/writes work out of the box."
      ]
    },
    {
      "kind": "section",
      "id": "catalog",
      "title": "Catalog configuration",
      "lead": "Iceberg's Spark catalog is the integration entry point. Configure it once; all table operations route through it.",
      "blocks": [
        {
          "kind": "paragraph",
          "content": [
            "Set the catalog as a ",
            { "kind": "code", "text": "spark.sql.catalog.*" },
            " configuration. The catalog handles snapshot atomicity, schema evolution, and time-travel queries transparently."
          ]
        },
        {
          "kind": "code",
          "language": "scala",
          "source": "spark.conf.set(\"spark.sql.catalog.icehouse\",\n  \"org.apache.iceberg.spark.SparkCatalog\")\nspark.conf.set(\"spark.sql.catalog.icehouse.type\", \"hadoop\")\nspark.conf.set(\"spark.sql.catalog.icehouse.warehouse\",\n  \"s3a://my-bucket/icehouse\")"
        }
      ]
    },
    {
      "kind": "section",
      "id": "procedures",
      "title": "Maintenance procedures",
      "lead": "Iceberg ships Spark stored procedures for the common maintenance operations. Schedule them as periodic jobs.",
      "blocks": [
        {
          "kind": "list",
          "style": "bullet",
          "items": [
            [
              { "kind": "code", "text": "CALL icehouse.system.rewrite_data_files" },
              " — merge small files into larger ones."
            ],
            [
              { "kind": "code", "text": "CALL icehouse.system.expire_snapshots" },
              " — drop snapshots older than a retention threshold."
            ],
            [
              { "kind": "code", "text": "CALL icehouse.system.remove_orphan_files" },
              " — garbage-collect files no longer referenced by any snapshot."
            ]
          ]
        }
      ]
    },
    {
      "kind": "section",
      "id": "next",
      "title": "Next",
      "blocks": [
        {
          "kind": "paragraph",
          "content": [
            "See the ",
            { "kind": "link", "text": "Iceberg overview", "href": "iceberg.html" },
            " page for the format-level details. Click around the site tree on the left to navigate."
          ]
        }
      ]
    }
  ]
}
